{
  "$schema": "https://json-schema.org/draft/2020-12/schema",
  "type": "object",
  "additionalProperties": false,
  "$id": "https://disponit.no/skjema/m17suiteartefakt-v1.json",
  "title": "m17 suiteartefakt (m17-suite-v1)",
  "comment": "Hele testsuiten kjoert paa staging, med M-17s andel (de ti filene modulen eier, pinnet i manifestskjema.M17_SUITE_ANDEL) maalt for seg. Tallene leses av pytests egen junit-XML, aldri av oppsummeringsteksten. Skrevet av deploy/staging/m17-suite-artefakt.py.",
  "required": [
    "krav_id",
    "ts",
    "bestatt",
    "oppsett",
    "maalt"
  ],
  "properties": {
    "krav_id": {
      "const": "m17-suite-v1"
    },
    "ts": {
      "type": "string",
      "minLength": 1
    },
    "bestatt": {
      "type": "boolean"
    },
    "oppsett": {
      "type": "object",
      "additionalProperties": false,
      "required": [
        "modul",
        "commit",
        "vert",
        "m17_filer",
        "bevisrot_sha256"
      ],
      "properties": {
        "modul": {
          "const": "m17_kundeservice"
        },
        "commit": {
          "type": "string",
          "pattern": "^[0-9a-f]{40}$"
        },
        "vert": {
          "type": "string",
          "minLength": 1
        },
        "bevisrot_sha256": {
          "type": "string",
          "minLength": 64,
          "maxLength": 64,
          "comment": "Tillitsgrensens anker (#131-K2/#132): EN digest over hele m17-produsentflaten (manifestskjema.M17_BEVISROT_FILER), re-regnet av porten over sitt eget tre. Artefaktet beviser KJOERINGEN - verten bindes av deploymentkjeden."
        },
        "m17_filer": {
          "type": "array",
          "minItems": 1,
          "items": {
            "type": "string",
            "minLength": 1
          },
          "comment": "M-17s PINNEDE andel, navngitt. Porten krever noeyaktig utvalget i KRAVGRENSER - en liste produsenten valgte selv er ikke delingsbetingelsen."
        }
      }
    },
    "maalt": {
      "type": "object",
      "additionalProperties": false,
      "required": [
        "tester_totalt",
        "tester_feilet",
        "tester_hoppet",
        "m17_tester",
        "m17_feilet",
        "m17_hoppet",
        "suite_exitkode",
        "m17_exitkode"
      ],
      "properties": {
        "tester_totalt": {
          "type": "integer",
          "minimum": 0
        },
        "tester_feilet": {
          "type": "integer",
          "minimum": 0
        },
        "tester_hoppet": {
          "type": "integer",
          "minimum": 0,
          "comment": "Hoppede tester. Junit teller dem i `tests` med null failures og null errors, saa gulvet maa maales mot KJOERTE tester - en hoppet test er ikke en bestaatt test."
        },
        "suite_exitkode": {
          "type": "integer",
          "minimum": 0,
          "comment": "pytests exitkode for hele suiten. Junit-XML skrives ogsaa for en AVBRUTT kjoering, og beskriver da bare testene som rakk aa bli ferdige - alle groenne. Bare 0 er en hel kjoering."
        },
        "m17_tester": {
          "type": "integer",
          "minimum": 0
        },
        "m17_feilet": {
          "type": "integer",
          "minimum": 0
        },
        "m17_hoppet": {
          "type": "integer",
          "minimum": 0,
          "comment": "Hoppede tester i M-17s PINNEDE andel. Hele andelen er skipif(not DSN), og fasitporten krever i tillegg sveiperollens og planarbeiderens egne DSN-er - uten den ville andelen sett groenn ut uten aa ha kjoert. Kravet er null."
        },
        "m17_exitkode": {
          "type": "integer",
          "minimum": 0,
          "comment": "Samme for M-17-andelens egen kjoering."
        }
      }
    }
  }
}
